{
  "schema_version": "1.0.0",
  "asset_id": "L2_d8b2ce3a0a12",
  "layer_class": "L2",
  "light": {
    "azimuth": "camera_left",
    "temporal_state": "dawn"
  },
  "style_register": "iyashikei_color",
  "crop_class": "bust",
  "anchor": {
    "point": "waist_line",
    "y_px": 1403
  },
  "eye_y_px": 482,
  "implied_camera": {
    "angle_bucket": "eye_level",
    "el_crossing": "chest"
  },
  "pose_id": "L2_d8b2ce3a0a12",
  "figure_height_m": 1.62
}
