{
  "schema_version": "1.0.0",
  "asset_id": "L2_054c9bbfde93",
  "layer_class": "L2",
  "light": {
    "azimuth": "camera_left",
    "temporal_state": "dawn"
  },
  "style_register": "iyashikei_color",
  "crop_class": "bust",
  "anchor": {
    "point": "waist_line",
    "y_px": 1435
  },
  "eye_y_px": 570,
  "implied_camera": {
    "angle_bucket": "eye_level",
    "el_crossing": "chest"
  },
  "pose_id": "L2_054c9bbfde93",
  "figure_height_m": 1.62
}
